<?xml version="1.0" encoding="utf-8"?>
<xs:schema targetNamespace="urn:students"  attributeFormDefault="unqualified" elementFormDefault="qualified" xmlns:xs="http://www.w3.org/2001/XMLSchema">
  <xs:element name="students">
    <xs:complexType>
      <xs:sequence>
        <xs:element maxOccurs="unbounded" name="student">
          <xs:complexType>
            <xs:sequence>
              <xs:element name="name" type="xs:string" />
              <xs:element name="sex" type="xs:string" />
              <xs:element name="birthDate" type="xs:date" />
              <xs:element name="phone" type="xs:string" />
              <xs:element name="email" type="xs:string" />
              <xs:element name="course" type="xs:string" />
              <xs:element name="specialty" type="xs:string" />
              <xs:element name="facultyNumber" type="xs:string" />
              <xs:element name="enrollment">
                <xs:complexType>
                  <xs:sequence>
                    <xs:element name="enrollmentDate" type="xs:date" />
                    <xs:element name="enrollmentScore" type="xs:decimal" />
                  </xs:sequence>
                </xs:complexType>
              </xs:element>
              <xs:element name="exams">
                <xs:complexType>
                  <xs:sequence>
                    <xs:element maxOccurs="unbounded" name="exam">
                      <xs:complexType>
                        <xs:sequence>
                          <xs:element name="examName" type="xs:string" />
                          <xs:element name="examScore" type="xs:decimal" />
                          <xs:element name="tutor">
                            <xs:complexType>
                              <xs:sequence>
                                <xs:element name="tutorName" type="xs:string" />
                                <xs:element name="endorsement" type="xs:unsignedShort" />
                              </xs:sequence>
                            </xs:complexType>
                          </xs:element>
                        </xs:sequence>
                      </xs:complexType>
                    </xs:element>
                  </xs:sequence>
                </xs:complexType>
              </xs:element>
            </xs:sequence>
          </xs:complexType>
        </xs:element>
      </xs:sequence>
    </xs:complexType>
  </xs:element>
</xs:schema>